{
  "$schema": "http://json-schema.org/draft-07/schema#",
  "type": "object",
  "additionalProperties": false,
  "required": [
    "name",
    "description",
    "author",
    "version",
    "category",
    "tags",
    "defaultConfig",
    "controls",
    "audioMapping",
    "performance"
  ],
  "properties": {
    "name": {"type": "string"},
    "description": {"type": "string"},
    "author": {"type": "string"},
    "version": {"type": "string"},
    "category": {"type": "string"},
    "tags": {
      "type": "array",
      "items": {"type": "string"}
    },
    "thumbnail": {"type": "string"},
    "note": {"type": "number"},
    "defaultConfig": {"type": "object"},
    "controls": {
      "type": "array",
      "items": {
        "type": "object",
        "additionalProperties": false,
        "required": ["name", "type", "label", "default"],
        "properties": {
          "name": {"type": "string"},
          "type": {
            "type": "string",
            "enum": ["slider", "color", "checkbox", "select", "text"]
          },
          "label": {"type": "string"},
          "min": {"type": "number"},
          "max": {"type": "number"},
          "step": {"type": "number"},
          "default": {},
          "options": {
            "type": "array",
            "items": {"type": "string"}
          }
        }
      }
    },
    "vfx": {
      "type": "object",
      "additionalProperties": false,
      "properties": {
        "effects": {
          "type": "array",
          "items": {
            "type": "object",
            "additionalProperties": false,
            "required": ["name", "label"],
            "properties": {
              "name": {"type": "string"},
              "label": {"type": "string"}
            }
          }
        }
      }
    },
    "audioMapping": {
      "type": "object",
      "additionalProperties": false,
      "patternProperties": {
        "^[a-zA-Z0-9_-]+$": {
          "type": "object",
          "additionalProperties": false,
          "required": ["description", "frequency", "effect"],
          "properties": {
            "description": {"type": "string"},
            "frequency": {"type": "string"},
            "effect": {"type": "string"}
          }
        }
      }
    },
    "performance": {
      "type": "object",
      "additionalProperties": false,
      "required": ["complexity", "recommendedFPS", "gpuIntensive"],
      "properties": {
        "complexity": {
          "type": "string",
          "enum": ["low", "medium", "high"]
        },
        "recommendedFPS": {"type": "number"},
        "gpuIntensive": {"type": "boolean"}
      }
    }
  }
}
