{
  "name": "Professional Plasma Ray",
  "description": "Refined plasma energy beam with layered wave animations",
  "author": "AudioVisualizer Pro",
  "version": "1.1.0",
  "category": "energy",
  "tags": ["energy", "plasma", "wave", "beam", "professional"],
  "thumbnail": "professional_plasma_ray_thumb.png",
  "note": 57,
  "defaultConfig": {
    "opacity": 1.0,
    "fadeMs": 100,
    "wave": {
      "width": 10.0,
      "height": 2.0,
      "segments": 400,
      "layers": 7,
      "speed": 0.4,
      "amplitude": 0.5,
      "direction": 1.0
    },
    "colors": {
      "hot": "#FF6B35",
      "warm": "#FF8E53",
      "cool": "#4FC3F7",
      "cold": "#29B6F6"
    },
    "flow": {
      "turbulence": 0.3,
      "frequency": 1.5,
      "phaseShift": 0.8,
      "smoothness": 0.9
    }
  },
  "controls": [
    { "name": "wave.amplitude", "type": "slider", "label": "Amplitud de Ondas", "min": 0.2, "max": 1.5, "step": 0.1, "default": 0.5 },
    { "name": "wave.speed", "type": "slider", "label": "Velocidad de Flujo", "min": 0.1, "max": 1.5, "step": 0.1, "default": 0.4 },
    { "name": "wave.direction", "type": "slider", "label": "Direccion (-1=Der→Izq, 1=Izq→Der)", "min": -1.0, "max": 1.0, "step": 2.0, "default": 1.0 },
    { "name": "flow.turbulence", "type": "slider", "label": "Turbulencia", "min": 0.1, "max": 1.0, "step": 0.1, "default": 0.3 }
  ],
  "audioMapping": {
    "low": { "description": "Controla amplitud y grosor del rayo", "frequency": "20-250 Hz", "effect": "Intensidad y anchura de las ondas" },
    "mid": { "description": "Modula la turbulencia y flujo", "frequency": "250-4000 Hz", "effect": "Variaciones en el patron de ondas" },
    "high": { "description": "Controla colores calientes y efectos", "frequency": "4000+ Hz", "effect": "Transiciones de color y brillantez" }
  },
  "performance": { "complexity": "low", "recommendedFPS": 60, "gpuIntensive": false }
}
