{
  "name": "Abstract Lines",
  "description": "Lineas abstractas que aparecen y desaparecen creando formas organicas con colores tenues",
  "author": "AudioVisualizer",
  "version": "1.0.0",
  "category": "abstract",
  "tags": ["abstract", "lines", "organic", "fluid", "minimal", "geometric"],
  "thumbnail": "abstract_lines_thumb.png",
  "note": 55,
  "defaultConfig": {
    "width": 1920,
    "height": 1080,
    "zoom": 1.0,
    "audioSensitivity": 1.0,
    "audioSmoothness": 0.5,
    "audioReactivity": 1.0,
    "paletteColor": "#ffffff",
    "opacity": 1.0,
    "fadeMs": 300,
    "lineCount": {
      "primary": 20,
      "secondary": 35,
      "detail": 50
    },
    "colors": {
      "primary": "#E8F4F8",
      "secondary": "#F0F8E8",
      "detail": "#F8F0E8",
      "accent": "#F8E8F0",
      "background": "#0A0F14"
    },
    "animation": {
      "appearanceSpeed": 0.8,
      "movementSpeed": 0.3,
      "formationSpeed": 1.2,
      "flickerIntensity": 0.4,
      "morphingRate": 0.6,
      "flowComplexity": 2.0
    },
    "effects": {
      "enableFlicker": true,
      "enableMorphing": true,
      "enableFormation": true,
      "enableFlow": true,
      "enableDepth": true
    },
    "geometry": {
      "maxLength": 2.5,
      "minLength": 0.3,
      "curvature": 0.4,
      "thickness": 0.8
    }
  },
  "controls": [
    {
      "name": "animation.appearanceSpeed",
      "type": "slider",
      "label": "Velocidad de Aparicion",
      "min": 0.1,
      "max": 3.0,
      "step": 0.1,
      "default": 0.8
    },
    {
      "name": "animation.movementSpeed",
      "type": "slider",
      "label": "Velocidad de Movimiento",
      "min": 0.1,
      "max": 2.0,
      "step": 0.1,
      "default": 0.3
    },
    {
      "name": "animation.formationSpeed",
      "type": "slider",
      "label": "Velocidad de Formacion",
      "min": 0.2,
      "max": 4.0,
      "step": 0.1,
      "default": 1.2
    },
    {
      "name": "animation.flickerIntensity",
      "type": "slider",
      "label": "Intensidad de Parpadeo",
      "min": 0.0,
      "max": 1.0,
      "step": 0.1,
      "default": 0.4
    },
    {
      "name": "animation.morphingRate",
      "type": "slider",
      "label": "Velocidad de Transformacion",
      "min": 0.1,
      "max": 2.0,
      "step": 0.1,
      "default": 0.6
    },
    {
      "name": "geometry.curvature",
      "type": "slider",
      "label": "Curvatura de Lineas",
      "min": 0.0,
      "max": 1.0,
      "step": 0.1,
      "default": 0.4
    },
    {
      "name": "geometry.thickness",
      "type": "slider",
      "label": "Grosor de Lineas",
      "min": 0.1,
      "max": 2.0,
      "step": 0.1,
      "default": 0.8
    },
    {
      "name": "effects.enableFlicker",
      "type": "checkbox",
      "label": "Efecto Parpadeo",
      "default": true
    },
    {
      "name": "effects.enableMorphing",
      "type": "checkbox",
      "label": "Transformacion Continua",
      "default": true
    },
    {
      "name": "effects.enableFormation",
      "type": "checkbox",
      "label": "Formacion de Patrones",
      "default": true
    },
    {
      "name": "colors.primary",
      "type": "color",
      "label": "Color Primario",
      "default": "#E8F4F8"
    },
    {
      "name": "colors.secondary",
      "type": "color",
      "label": "Color Secundario",
      "default": "#F0F8E8"
    },
    {
      "name": "colors.detail",
      "type": "color",
      "label": "Color de Detalle",
      "default": "#F8F0E8"
    },
    {
      "name": "colors.accent",
      "type": "color",
      "label": "Color de Acento",
      "default": "#F8E8F0"
    }
  ],
  "audioMapping": {
    "low": {
      "description": "Controla la aparicion y movimiento de lineas primarias",
      "frequency": "20-250 Hz",
      "effect": "Generacion de lineas principales y formaciones basicas"
    },
    "mid": {
      "description": "Controla las lineas secundarias y transformaciones",
      "frequency": "250-4000 Hz",
      "effect": "Morfologia y patrones intermedios"
    },
    "high": {
      "description": "Controla los detalles finos y efectos de parpadeo",
      "frequency": "4000+ Hz",
      "effect": "Lineas de detalle y efectos sutiles"
    }
  },
  "performance": {
    "complexity": "medium",
    "recommendedFPS": 60,
    "gpuIntensive": false
  }
}