{
  "name": "Audio Tunnel Grid",
  "description": "Infinite tunnel with grid pattern and audio-reactive circles",
  "author": "Jungle Lab Studio",
  "version": "1.0.0",
  "category": "generative",
  "tags": ["tunnel", "grid", "audio-reactive", "psychedelic"],
  "thumbnail": "audio_tunnel_grid_thumb.png",
  "note": 72,
  "defaultConfig": {
    "speed": 0.5,
    "tunnelColor1": "#8000cc",
    "tunnelColor2": "#00ccff",
    "gridSegments": 8,
    "rotationSpeed": 0.1,
    "bassResponse": 0.3,
    "circleCount": 6
  },
  "controls": [
    { "name": "speed", "type": "slider", "label": "Tunnel Speed", "min": 0.1, "max": 3.0, "step": 0.1, "default": 0.5 },
    { "name": "tunnelColor1", "type": "color", "label": "Color 1 (Purple)", "default": "#8000cc" },
    { "name": "tunnelColor2", "type": "color", "label": "Color 2 (Cyan)", "default": "#00ccff" },
    { "name": "gridSegments", "type": "slider", "label": "Grid Segments", "min": 4, "max": 16, "step": 1, "default": 8 },
    { "name": "rotationSpeed", "type": "slider", "label": "Rotation Speed", "min": 0, "max": 1, "step": 0.05, "default": 0.1 },
    { "name": "bassResponse", "type": "slider", "label": "Bass Response", "min": 0, "max": 1, "step": 0.1, "default": 0.3 },
    { "name": "circleCount", "type": "slider", "label": "Circle Mirrors", "min": 3, "max": 12, "step": 1, "default": 6 }
  ],
  "audioMapping": {
    "bass": "bassResponse"
  },
  "performance": {
    "complexity": "medium",
    "recommendedFPS": 60,
    "gpuIntensive": false
  }
}
