{
  "name": "Ambient Tunnel",
  "description": "Slow moving neon tunnel for drone backgrounds",
  "author": "AudioVisualizer",
  "version": "1.0.0",
  "category": "background",
  "tags": ["ambient", "tunnel", "background"],
  "thumbnail": "ambient_tunnel_thumb.png",
  "note": 70,
  "defaultConfig": {
    "speed": 0.5,
    "color": "#3366ff"
  },
  "controls": [
    { "name": "speed", "type": "slider", "label": "Speed", "min": 0.1, "max": 2.0, "step": 0.1, "default": 0.5 },
    { "name": "color", "type": "color", "label": "Color", "default": "#3366ff" }
  ],
  "audioMapping": {},
  "performance": { "complexity": "low", "recommendedFPS": 60, "gpuIntensive": false }
}
