{
  "name": "Boom Wave",
  "description": "Expanding ring pulse",
  "author": "AudioVisualizer",
  "version": "1.0.0",
  "category": "one-shot",
  "tags": ["ring", "pulse", "one-shot"],
  "thumbnail": "boom_wave_thumb.png",
  "note": 58,
  "defaultConfig": {
    "opacity": 1.0,
    "duration": 1.5,
    "color": "#00aaff",
    "maxRadius": 5
  },
  "controls": [
    {"name": "color", "type": "color", "label": "Color", "default": "#00aaff"},
    {"name": "maxRadius", "type": "slider", "label": "Max Radius", "min": 1, "max": 10, "step": 0.5, "default": 5},
    {"name": "duration", "type": "slider", "label": "Duration", "min": 0.5, "max": 3, "step": 0.1, "default": 1.5}
  ],
  "audioMapping": {
    "low": {
      "description": "Slight expansion",
      "frequency": "20-250 Hz",
      "effect": "Radius"
    },
    "mid": {
      "description": "Color modulation",
      "frequency": "250-4000 Hz",
      "effect": "Hue"
    },
    "high": {
      "description": "Adds subtle brightness",
      "frequency": "4000+ Hz",
      "effect": "Brightness"
    }
  },
  "performance": {
    "complexity": "low",
    "recommendedFPS": 60,
    "gpuIntensive": false
  }
}
