{
  "name": "Text Glitch",
  "description": "Animated text with glitch effects and scrambled letter appearance",
  "author": "AudioVisualizer",
  "version": "1.0.0",
  "category": "text",
  "tags": ["text", "glitch", "animated", "cyberpunk", "digital"],
  "thumbnail": "text_glitch_thumb.png",
  "note": 61,
  "defaultConfig": {
    "width": 1920,
    "height": 1080,
    "zoom": 1.0,
    "audioSensitivity": 1.0,
    "audioSmoothness": 0.5,
    "audioReactivity": 1.0,
    "paletteColor": "#ffffff",
    "opacity": 1.0,
    "fadeMs": 500,
    "text": {
      "content": "ROBOTICA",
      "fontSize": 120,
      "fontFamily": "Arial Black, sans-serif",
      "letterSpacing": 0.3,
      "lineHeight": 1.2
    },
    "animation": {
      "letterDelay": 0.8,
      "shuffleIntensity": 0.7,
      "glitchFrequency": 2.5,
      "fadeInDuration": 1.2,
      "repositionSpeed": 1.5,
      "digitalDistortion": 0.6
    },
    "colors": {
      "primary": "#00FF88",
      "secondary": "#FF0088",
      "accent": "#88FF00",
      "glitch1": "#FF4444",
      "glitch2": "#4444FF",
      "background": "#0A0F14"
    },
    "effects": {
      "enableGlitch": true,
      "enableShuffle": true,
      "enableScanlines": true,
      "enableChromatic": true,
      "enableNoise": true,
      "glitchIntensity": 0.8,
      "chromaticAberration": 0.3,
      "scanlineSpeed": 2.0,
      "noiseLevel": 0.15
    },
    "layout": {
      "centerX": 0.5,
      "centerY": 0.5,
      "scatterRadius": 200,
      "finalSpacing": 80,
      "verticalOffset": 30
    }
  },
  "controls": [
    {
      "name": "text.content",
      "type": "text",
      "label": "Text to Display",
      "default": "ROBOTICA"
    },
    {
      "name": "text.fontSize",
      "type": "slider",
      "label": "Font Size",
      "min": 40,
      "max": 200,
      "step": 10,
      "default": 120
    },
    {
      "name": "animation.letterDelay",
      "type": "slider",
      "label": "Letter Delay",
      "min": 0.2,
      "max": 2.0,
      "step": 0.1,
      "default": 0.8
    },
    {
      "name": "animation.shuffleIntensity",
      "type": "slider",
      "label": "Shuffle Intensity",
      "min": 0.0,
      "max": 1.0,
      "step": 0.1,
      "default": 0.7
    },
    {
      "name": "animation.glitchFrequency",
      "type": "slider",
      "label": "Glitch Frequency",
      "min": 0.5,
      "max": 5.0,
      "step": 0.1,
      "default": 2.5
    },
    {
      "name": "effects.glitchIntensity",
      "type": "slider",
      "label": "Glitch Intensity",
      "min": 0.0,
      "max": 1.0,
      "step": 0.1,
      "default": 0.8
    },
    {
      "name": "effects.chromaticAberration",
      "type": "slider",
      "label": "Chromatic Aberration",
      "min": 0.0,
      "max": 1.0,
      "step": 0.1,
      "default": 0.3
    },
    {
      "name": "effects.enableGlitch",
      "type": "checkbox",
      "label": "Enable Glitch",
      "default": true
    },
    {
      "name": "effects.enableShuffle",
      "type": "checkbox",
      "label": "Enable Shuffle",
      "default": true
    },
    {
      "name": "effects.enableScanlines",
      "type": "checkbox",
      "label": "Scanlines",
      "default": true
    },
    {
      "name": "effects.enableChromatic",
      "type": "checkbox",
      "label": "Chromatic Aberration",
      "default": true
    },
    {
      "name": "colors.primary",
      "type": "color",
      "label": "Primary Color",
      "default": "#00FF88"
    },
    {
      "name": "colors.secondary",
      "type": "color",
      "label": "Secondary Color",
      "default": "#FF0088"
    },
    {
      "name": "colors.accent",
      "type": "color",
      "label": "Accent Color",
      "default": "#88FF00"
    },
    {
      "name": "colors.glitch1",
      "type": "color",
      "label": "Glitch Color 1",
      "default": "#FF4444"
    },
    {
      "name": "colors.glitch2",
      "type": "color",
      "label": "Glitch Color 2",
      "default": "#4444FF"
    }
  ],
  "audioMapping": {
    "low": {
      "description": "Controls letter appearance and timing",
      "frequency": "20-250 Hz",
      "effect": "Appearance speed and base movements"
    },
    "mid": {
      "description": "Modulates glitch and distortion effects",
      "frequency": "250-4000 Hz",
      "effect": "Glitch intensity and digital effects"
    },
    "high": {
      "description": "Controls high-frequency effects and details",
      "frequency": "4000+ Hz",
      "effect": "Scanlines, noise and chromatic aberration"
    }
  },
  "performance": {
    "complexity": "medium",
    "recommendedFPS": 60,
    "gpuIntensive": false
  }
}