{
  "name": "Evolutive Particles",
  "description": "Sistema de partículas evolutivo que forma estructuras complejas y se adapta al audio",
  "author": "AudioVisualizer",
  "version": "1.0.0",
  "category": "particles",
  "tags": ["particles", "evolution", "organic", "complex", "adaptive", "swarm"],
  "thumbnail": "evolutive_particles_thumb.png",
  "note": 56,
  "defaultConfig": {
    "width": 1920,
    "height": 1080,
    "zoom": 1.0,
    "audioSensitivity": 1.0,
    "audioSmoothness": 0.5,
    "audioReactivity": 1.0,
    "paletteColor": "#ffffff",
    "opacity": 1.0,
    "fadeMs": 250,
    "particleCount": {
      "base": 800,
      "evolved": 1200,
      "maximum": 2000
    },
    "colors": {
      "birth": "#FF6B9D",
      "juvenile": "#4ECDC4",
      "mature": "#45B7D1",
      "elder": "#96CEB4",
      "death": "#FECA57",
      "connections": "#A8E6CF"
    },
    "evolution": {
      "lifespanBase": 8.0,
      "mutationRate": 0.3,
      "adaptationSpeed": 1.5,
      "complexityGrowth": 0.8,
      "socialBehavior": 0.6,
      "emergenceThreshold": 0.7
    },
    "behavior": {
      "attraction": 0.4,
      "repulsion": 0.2,
      "alignment": 0.5,
      "cohesion": 0.3,
      "exploration": 0.6,
      "collaboration": 0.4
    },
    "physics": {
      "gravity": 0.1,
      "friction": 0.95,
      "elasticity": 0.8,
      "turbulence": 0.3
    },
    "effects": {
      "enableTrails": true,
      "enableConnections": true,
      "enableEvolution": true,
      "enableEmergence": true,
      "enableGlow": true
    }
  },
  "controls": [
    {
      "name": "evolution.lifespanBase",
      "type": "slider",
      "label": "Vida Base de Partículas",
      "min": 2.0,
      "max": 20.0,
      "step": 0.5,
      "default": 8.0
    },
    {
      "name": "evolution.mutationRate",
      "type": "slider",
      "label": "Tasa de Mutación",
      "min": 0.0,
      "max": 1.0,
      "step": 0.1,
      "default": 0.3
    },
    {
      "name": "evolution.adaptationSpeed",
      "type": "slider",
      "label": "Velocidad de Adaptación",
      "min": 0.1,
      "max": 3.0,
      "step": 0.1,
      "default": 1.5
    },
    {
      "name": "evolution.complexityGrowth",
      "type": "slider",
      "label": "Crecimiento de Complejidad",
      "min": 0.0,
      "max": 2.0,
      "step": 0.1,
      "default": 0.8
    },
    {
      "name": "behavior.attraction",
      "type": "slider",
      "label": "Fuerza de Atracción",
      "min": 0.0,
      "max": 1.0,
      "step": 0.1,
      "default": 0.4
    },
    {
      "name": "evolution.socialBehavior",
      "type": "slider",
      "label": "Comportamiento Social",
      "min": 0.0,
      "max": 1.0,
      "step": 0.1,
      "default": 0.6
    },
    {
      "name": "physics.turbulence",
      "type": "slider",
      "label": "Turbulencia",
      "min": 0.0,
      "max": 1.0,
      "step": 0.1,
      "default": 0.3
    },
    {
      "name": "effects.enableTrails",
      "type": "checkbox",
      "label": "Estelas de Partículas",
      "default": true
    },
    {
      "name": "effects.enableConnections",
      "type": "checkbox",
      "label": "Conexiones Dinámicas",
      "default": true
    },
    {
      "name": "effects.enableEvolution",
      "type": "checkbox",
      "label": "Evolución Activa",
      "default": true
    },
    {
      "name": "effects.enableEmergence",
      "type": "checkbox",
      "label": "Comportamiento Emergente",
      "default": true
    },
    {
      "name": "colors.birth",
      "type": "color",
      "label": "Color Nacimiento",
      "default": "#FF6B9D"
    },
    {
      "name": "colors.juvenile",
      "type": "color",
      "label": "Color Juvenil",
      "default": "#4ECDC4"
    },
    {
      "name": "colors.mature",
      "type": "color",
      "label": "Color Maduro",
      "default": "#45B7D1"
    },
    {
      "name": "colors.elder",
      "type": "color",
      "label": "Color Anciano",
      "default": "#96CEB4"
    }
  ],
  "audioMapping": {
    "low": {
      "description": "Controla el nacimiento y comportamiento básico de partículas",
      "frequency": "20-250 Hz",
      "effect": "Generación de nuevas partículas y movimientos fundamentales"
    },
    "mid": {
      "description": "Influye en la evolución y complejidad del sistema",
      "frequency": "250-4000 Hz",
      "effect": "Mutaciones, adaptaciones y comportamientos sociales"
    },
    "high": {
      "description": "Desencadena eventos de emergencia y efectos avanzados",
      "frequency": "4000+ Hz",
      "effect": "Comportamientos emergentes y efectos visuales complejos"
    }
  },
  "performance": {
    "complexity": "high",
    "recommendedFPS": 60,
    "gpuIntensive": true
  }
}